### ISSUE TITLE
How to receive delivery status on PDU?

### ISSUE THREAD

**Issue by sujit-baniya** [M2MGateway/go-smpp#9]
I tried following code but I didn't receive delivery status

```go
package main

import (
	"context"
	"fmt"
	"github.com/sujit-baniya/go-smpp"
	"github.com/sujit-baniya/go-smpp/pdu"
	"net"
	"time"
)

func main() {
	connect()
	handshake()
	rs := send()
	fmt.Println(rs)
	wait()
}

var (
	n = time.Duration(10)
	conn = &smpp.Conn{}
)

func connect() {
	parent, err := net.Dial("tcp", "smscsim.melroselabs.com:2775")
	if err != nil {
		panic(err)
	}
	conn = smpp.NewConn(context.Background(), parent)
	conn.WriteTimeout = n * time.Second // set write timeout (optional, default 15 minutes)
	conn.ReadTimeout =  n * time.Second // set read timeout  (optional, default 15 minutes)
	go conn.Watch()                     // start watchdog
}

func handshake() {
	resp, err := conn.Submit(context.Background(), &pdu.BindTransceiver{
		SystemID:   "444320",
		Password:   "5691c2",
		SystemType: "",
		Version:    pdu.SMPPVersion50,
	})
	if err != nil {
		panic(err)
	}
	r := resp.(*pdu.BindTransceiverResp)
	if r.Header.CommandStatus == 0 {
		// start keep-alive
		go conn.EnquireLink(time.Minute, time.Minute)
	}
}

func send() interface{} {
	packet := &pdu.SubmitSM{
		SourceAddr: pdu.Address{TON: 1, NPI: 1, No: "00919821"},
		DestAddr:   pdu.Address{TON: 1, NPI: 1, No: "99919821"},
		RegisteredDelivery: pdu.RegisteredDelivery{
			MCDeliveryReceipt:           1,
			SMEOriginatedAcknowledgment: 1,
			IntermediateNotification:    true,
			Reserved:                    7,
		},
	}
	err := packet.Message.Compose("Hello World!")
	if err != nil {
		panic(err)
	}
	resp, err := conn.Submit(context.Background(), packet)
	if err != nil {
		panic(err)
	}
	return resp // submit_sm_resp returns
}

func wait() {
	for {
		packet := <-conn.PDU()
		// reply a responsable packet
		if p, ok := packet.(pdu.Responsable); ok {
			fmt.Println(p.Resp())
			err := conn.Send(p.Resp())
			if err != nil {
				fmt.Println(err)
			}
		}
	}
}
```

**Comment by septs** [comment]
https://github.com/M2MGateway/go-smpp/blob/6c6ef183a2dd9e8ff6b928b5127244d9a48b0b7e/cmd/smpp-receiver/main.go#L90-L94

**Comment by septs** [comment]
delivery status?

**Comment by sujit-baniya** [comment]
Yes! When I set DelivertReceipt = 1 on other package, on the connection I get the DELIVR or any other final status in DeliverSM PDU. I tried similar but didn't receive the status

**Comment by sujit-baniya** [comment]
I mean

```
SubmitSMResp:&{base:{Header:{CommandLength:81 CommandID:SUBMIT_SM_RESP CommandStatus:ESME_ROK SequenceNumber:9} OptionalParameters:map[]} MessageID:f50fa69e09611d3ce899bd2daf99de5e1598a3496a50a4e260b4dc8f6ad832ff}
DeliverSM:&{base:{Header:{CommandLength:290 CommandID:DELIVER_SM CommandStatus:ESME_ROK SequenceNumber:1} OptionalParameters:map[30:{Tag:30 Data:[102 53 48 102 97 54 57 101 48 57 54 49 49 100 51 99 101 56 57 57 98 100 50 100 97 102 57 57 100 101 53 101 49 53 57 56 97 51 52 57 54 97 53 48 97 52 101 50 54 48 98 52 100 99 56 102 54 97 100 56 51 50 102 102 0]} 1059:{Tag:1059 Data:[3 0 0]} 1063:{Tag:1063 Data:[2]}]} ServiceType: SourceAddr:16109104919 DestAddr:00522241 EsmClass:4 ProtocolID:0 PriorityFlag:0 ScheduleDeliveryTime: ValidityPeriod: RegisteredDelivery:0 ReplaceIfPresentFlag:0 Message:{SmDefaultMsgID:0 message: enc:0x14aeccc udHeader:[] messageData:[105 100 58 102 53 48 102 97 54 57 101 48 57 54 49 49 100 51 99 101 56 57 57 98 100 50 100 97 102 57 57 100 101 53 101 49 53 57 56 97 51 52 57 54 97 53 48 97 52 101 50 54 48 98 52 100 99 56 102 54 97 100 56 51 50 102 102 32 115 117 98 58 48 48 48 32 100 108 118 114 100 58 48 48 49 32 115 117 98 109 105 116 32 100 97 116 101 58 50 49 48 55 50 56 49 49 49 50 32 100 111 110 101 32 100 97 116 101 58 50 49 48 55 50 56 49 49 49 50 32 115 116 97 116 58 68 69 76 73 86 82 68 32 101 114 114 58 48 48 48 32 116 101 120 116 58 0] withoutDataCoding:false}}
```

I'm trying to look for this status
```
2021/07/28 16:57:45 id:f50fa69e09611d3ce899bd2daf99de5e1598a3496a50a4e260b4dc8f6ad832ff sub:000 dlvrd:001 submit date:2107281112 done date:2107281112 stat:DELIVRD err:000 text:@ <nil>
```

**Comment by septs** [comment]
please provide a packet capture record, thanks

send to `m2m-gateway (at) septs.email`

**Comment by sujit-baniya** [comment]
@septs I see the dlvrd packets in the record

```
        0x0030:  0101 080a 7ea0 d869 0000 0000 0402 0000  ....~..i........
17:13:52.719931 IP (tos 0x0, ttl 216, id 0, offset 0, flags [DF], proto TCP (6), length 60)
    ec2-18-200-51-80.eu-west-1.compute.amazonaws.com.smpp > 192.168.100.197.60782: Flags [S.E], cksum 0xfce6 (correct), seq 4093353242, ack 979319801, win 26847, options [mss 1412,sackOK,TS val 476578669 ecr 2124470377,nop,wscale 7], length 0
        0x0000:  4500 003c 0000 4000 d806 3736 12c8 3350  E..<..@...76..3P
        0x0010:  c0a8 64c5 0ad7 ed6e f3fb 9d1a 3a5f 3bf9  ..d....n....:_;.
        0x0020:  a052 68df fce6 0000 0204 0584 0402 080a  .Rh.............
        0x0030:  1c68 036d 7ea0 d869 0103 0307            .h.m~..i....
17:13:52.720021 IP (tos 0x0, ttl 64, id 0, offset 0, flags [DF], proto TCP (6), length 52)
    192.168.100.197.60782 > ec2-18-200-51-80.eu-west-1.compute.amazonaws.com.smpp: Flags [.], cksum 0x8bea (correct), seq 1, ack 1, win 2056, options [nop,nop,TS val 2124470553 ecr 476578669], length 0
        0x0000:  4500 0034 0000 4000 4006 cf3e c0a8 64c5  E..4..@.@..>..d.
        0x0010:  12c8 3350 ed6e 0ad7 3a5f 3bf9 f3fb 9d1b  ..3P.n..:_;.....
        0x0020:  8010 0808 8bea 0000 0101 080a 7ea0 d919  ............~...
        0x0030:  1c68 036d                                .h.m
17:13:52.720218 IP (tos 0x2,ECT(0), ttl 64, id 0, offset 0, flags [DF], proto TCP (6), length 87)
    192.168.100.197.60782 > ec2-18-200-51-80.eu-west-1.compute.amazonaws.com.smpp: Flags [P.], cksum 0x8753 (correct), seq 1:36, ack 1, win 2056, options [nop,nop,TS val 2124470553 ecr 476578669], length 35
        0x0000:  4502 0057 0000 4000 4006 cf19 c0a8 64c5  E..W..@.@.....d.
        0x0010:  12c8 3350 ed6e 0ad7 3a5f 3bf9 f3fb 9d1b  ..3P.n..:_;.....
        0x0020:  8018 0808 8753 0000 0101 080a 7ea0 d919  .....S......~...
        0x0030:  1c68 036d 0000 0023 0000 0009 0000 0000  .h.m...#........
        0x0040:  4d65 8221 3434 3433 3230 0035 3639 3163  Me.!444320.5691c
        0x0050:  3200 0050 0000 00                        2..P...
17:13:52.899702 IP (tos 0x0, ttl 216, id 52374, offset 0, flags [DF], proto TCP (6), length 52)
    ec2-18-200-51-80.eu-west-1.compute.amazonaws.com.smpp > 192.168.100.197.60782: Flags [.], cksum 0x9249 (correct), seq 1, ack 36, win 210, options [nop,nop,TS val 476578849 ecr 2124470553], length 0
        0x0000:  4500 0034 cc96 4000 d806 6aa7 12c8 3350  E..4..@...j...3P
        0x0010:  c0a8 64c5 0ad7 ed6e f3fb 9d1b 3a5f 3c1c  ..d....n....:_<.
        0x0020:  8010 00d2 9249 0000 0101 080a 1c68 0421  .....I.......h.!
        0x0030:  7ea0 d919                                ~...
17:13:52.899726 IP (tos 0x2,ECT(0), ttl 216, id 52375, offset 0, flags [DF], proto TCP (6), length 89)
    ec2-18-200-51-80.eu-west-1.compute.amazonaws.com.smpp > 192.168.100.197.60782: Flags [P.], cksum 0x18b5 (correct), seq 1:38, ack 36, win 210, options [nop,nop,TS val 476578849 ecr 2124470553], length 37
        0x0000:  4502 0059 cc97 4000 d806 6a7f 12c8 3350  E..Y..@...j...3P
        0x0010:  c0a8 64c5 0ad7 ed6e f3fb 9d1b 3a5f 3c1c  ..d....n....:_<.
        0x0020:  8018 00d2 18b5 0000 0101 080a 1c68 0421  .............h.!
        0x0030:  7ea0 d919 0000 0025 8000 0009 0000 0000  ~......%........
        0x0040:  4d65 8221 4d65 6c72 6f73 654c 6162 7353  Me.!MelroseLabsS
        0x0050:  4d53 4300 0210 0001 34                   MSC.....4
17:13:52.899852 IP (tos 0x0, ttl 64, id 0, offset 0, flags [DF], proto TCP (6), length 52)
    192.168.100.197.60782 > ec2-18-200-51-80.eu-west-1.compute.amazonaws.com.smpp: Flags [.], cksum 0x8a3c (correct), seq 36, ack 38, win 2055, options [nop,nop,TS val 2124470732 ecr 476578849], length 0
        0x0000:  4500 0034 0000 4000 4006 cf3e c0a8 64c5  E..4..@.@..>..d.
        0x0010:  12c8 3350 ed6e 0ad7 3a5f 3c1c f3fb 9d40  ..3P.n..:_<....@
        0x0020:  8010 0807 8a3c 0000 0101 080a 7ea0 d9cc  .....<......~...
        0x0030:  1c68 0421                                .h.!
17:13:52.900210 IP (tos 0x2,ECT(0), ttl 64, id 0, offset 0, flags [DF], proto TCP (6), length 112)
    192.168.100.197.60782 > ec2-18-200-51-80.eu-west-1.compute.amazonaws.com.smpp: Flags [P.], cksum 0x9316 (correct), seq 36:96, ack 38, win 2055, options [nop,nop,TS val 2124470732 ecr 476578849], length 60
        0x0000:  4502 0070 0000 4000 4006 cf00 c0a8 64c5  E..p..@.@.....d.
        0x0010:  12c8 3350 ed6e 0ad7 3a5f 3c1c f3fb 9d40  ..3P.n..:_<....@
        0x0020:  8018 0807 9316 0000 0101 080a 7ea0 d9cc  ............~...
        0x0030:  1c68 0421 0000 003c 0000 0004 0000 0000  .h.!...<........
        0x0040:  7862 9a0f 0001 0130 3039 3139 3832 3100  xb.....00919821.
        0x0050:  0101 3939 3931 3938 3231 0000 0000 0000  ..99919821......
        0x0060:  f500 0000 0bc8 329b fd06 5ddf 7236 3904  ......2...].r69.
17:13:52.900253 IP (tos 0x2,ECT(0), ttl 64, id 0, offset 0, flags [DF], proto TCP (6), length 68)
    192.168.100.197.60782 > ec2-18-200-51-80.eu-west-1.compute.amazonaws.com.smpp: Flags [P.], cksum 0xe6eb (correct), seq 96:112, ack 38, win 2055, options [nop,nop,TS val 2124470732 ecr 476578849], length 16
        0x0000:  4502 0044 0000 4000 4006 cf2c c0a8 64c5  E..D..@.@..,..d.
        0x0010:  12c8 3350 ed6e 0ad7 3a5f 3c58 f3fb 9d40  ..3P.n..:_<X...@
        0x0020:  8018 0807 e6eb 0000 0101 080a 7ea0 d9cc  ............~...
        0x0030:  1c68 0421 0000 0010 0000 0015 0000 0000  .h.!............
        0x0040:  5510 4dc7                                U.M.
17:13:53.080300 IP (tos 0x0, ttl 216, id 52376, offset 0, flags [DF], proto TCP (6), length 52)
    ec2-18-200-51-80.eu-west-1.compute.amazonaws.com.smpp > 192.168.100.197.60782: Flags [.], cksum 0x9071 (correct), seq 38, ack 112, win 210, options [nop,nop,TS val 476579029 ecr 2124470732], length 0
        0x0000:  4500 0034 cc98 4000 d806 6aa5 12c8 3350  E..4..@...j...3P
        0x0010:  c0a8 64c5 0ad7 ed6e f3fb 9d40 3a5f 3c68  ..d....n...@:_<h
        0x0020:  8010 00d2 9071 0000 0101 080a 1c68 04d5  .....q.......h..
        0x0030:  7ea0 d9cc                                ~...
17:13:53.080459 IP (tos 0x2,ECT(0), ttl 216, id 52377, offset 0, flags [DF], proto TCP (6), length 133)
    ec2-18-200-51-80.eu-west-1.compute.amazonaws.com.smpp > 192.168.100.197.60782: Flags [P.], cksum 0x2a8f (correct), seq 38:119, ack 112, win 210, options [nop,nop,TS val 476579030 ecr 2124470732], length 81
        0x0000:  4502 0085 cc99 4000 d806 6a51 12c8 3350  E.....@...jQ..3P
        0x0010:  c0a8 64c5 0ad7 ed6e f3fb 9d40 3a5f 3c68  ..d....n...@:_<h
        0x0020:  8018 00d2 2a8f 0000 0101 080a 1c68 04d6  ....*........h..
        0x0030:  7ea0 d9cc 0000 0051 8000 0004 0000 0000  ~......Q........
        0x0040:  7862 9a0f 3236 6561 3562 3434 3630 6132  xb..26ea5b4460a2
        0x0050:  6634 6235 3063 3632 6632 3362 3063 3634  f4b50c62f23b0c64
        0x0060:  3839 6534 3965 3132 6566 3564 6637 6666  89e49e12ef5df7ff
        0x0070:  3230 3735 3937 6130 3765 6265 3964 3230  207597a07ebe9d20
        0x0080:  3033 6238 00                             03b8.
17:13:53.080534 IP (tos 0x0, ttl 64, id 0, offset 0, flags [DF], proto TCP (6), length 52)
    192.168.100.197.60782 > ec2-18-200-51-80.eu-west-1.compute.amazonaws.com.smpp: Flags [.], cksum 0x8837 (correct), seq 112, ack 119, win 2054, options [nop,nop,TS val 2124470912 ecr 476579030], length 0
        0x0000:  4500 0034 0000 4000 4006 cf3e c0a8 64c5  E..4..@.@..>..d.
        0x0010:  12c8 3350 ed6e 0ad7 3a5f 3c68 f3fb 9d91  ..3P.n..:_<h....
        0x0020:  8010 0806 8837 0000 0101 080a 7ea0 da80  .....7......~...
        0x0030:  1c68 04d6                                .h..
17:13:53.270098 IP (tos 0x2,ECT(0), ttl 216, id 52378, offset 0, flags [DF], proto TCP (6), length 355)
    ec2-18-200-51-80.eu-west-1.compute.amazonaws.com.smpp > 192.168.100.197.60782: Flags [P.], cksum 0xa80d (correct), seq 119:422, ack 112, win 210, options [nop,nop,TS val 476579210 ecr 2124470912], length 303
        0x0000:  4502 0163 cc9a 4000 d806 6972 12c8 3350  E..c..@...ir..3P
        0x0010:  c0a8 64c5 0ad7 ed6e f3fb 9d91 3a5f 3c68  ..d....n....:_<h
        0x0020:  8018 00d2 a80d 0000 0101 080a 1c68 058a  .............h..
        0x0030:  7ea0 da80 0000 0010 8000 0015 0000 0000  ~...............
        0x0040:  5510 4dc7 0000 011f 0000 0005 0000 0000  U.M.............
        0x0050:  0000 0001 0001 0139 3939 3139 3832 3100  .......99919821.
        0x0060:  0101 3030 3931 3938 3231 0004 0000 0000  ..00919821......
        0x0070:  0000 0000 9d69 643a 3236 6561 3562 3434  .....id:26ea5b44
        0x0080:  3630 6132 6634 6235 3063 3632 6632 3362  60a2f4b50c62f23b
        0x0090:  3063 3634 3839 6534 3965 3132 6566 3564  0c6489e49e12ef5d
        0x00a0:  6637 6666 3230 3735 3937 6130 3765 6265  f7ff207597a07ebe
        0x00b0:  3964 3230 3033 6238 2073 7562 3a30 3030  9d2003b8.sub:000
        0x00c0:  2064 6c76 7264 3a30 3031 2073 7562 6d69  .dlvrd:001.submi
        0x00d0:  7420 6461 7465 3a32 3130 3732 3831 3132  t.date:210728112
        0x00e0:  3820 646f 6e65 2064 6174 653a 3231 3037  8.done.date:2107
        0x00f0:  3238 3131 3238 2073 7461 743a 4445 4c49  281128.stat:DELI
        0x0100:  5652 4420 6572 723a 3030 3020 7465 7874  VRD.err:000.text
        0x0110:  3a00 0427 0001 0204 2300 0303 0000 001e  :..'....#.......
        0x0120:  0041 3236 6561 3562 3434 3630 6132 6634  .A26ea5b4460a2f4
        0x0130:  6235 3063 3632 6632 3362 3063 3634 3839  b50c62f23b0c6489
        0x0140:  6534 3965 3132 6566 3564 6637 6666 3230  e49e12ef5df7ff20
        0x0150:  3735 3937 6130 3765 6265 3964 3230 3033  7597a07ebe9d2003
        0x0160:  6238 00                                  b8.
17:13:53.270182 IP (tos 0x0, ttl 64, id 0, offset 0, flags [DF], proto TCP (6), length 52)
    192.168.100.197.60782 > ec2-18-200-51-80.eu-west-1.compute.amazonaws.com.smpp: Flags [.], cksum 0x859d (correct), seq 112, ack 422, win 2049, options [nop,nop,TS val 2124471100 ecr 476579210], length 0
        0x0000:  4500 0034 0000 4000 4006 cf3e c0a8 64c5  E..4..@.@..>..d.
        0x0010:  12c8 3350 ed6e 0ad7 3a5f 3c68 f3fb 9ec0  ..3P.n..:_<h....
        0x0020:  8010 0801 859d 0000 0101 080a 7ea0 db3c  ............~..<
        0x0030:  1c68 058a                                .h..
17:13:53.270369 IP (tos 0x2,ECT(0), ttl 64, id 0, offset 0, flags [DF], proto TCP (6), length 69)
    192.168.100.197.60782 > ec2-18-200-51-80.eu-west-1.compute.amazonaws.com.smpp: Flags [P.], cksum 0x056d (correct), seq 112:129, ack 422, win 2049, options [nop,nop,TS val 2124471100 ecr 476579210], length 17
        0x0000:  4502 0045 0000 4000 4006 cf2b c0a8 64c5  E..E..@.@..+..d.
        0x0010:  12c8 3350 ed6e 0ad7 3a5f 3c68 f3fb 9ec0  ..3P.n..:_<h....
        0x0020:  8018 0801 056d 0000 0101 080a 7ea0 db3c  .....m......~..<
        0x0030:  1c68 058a 0000 0011 8000 0005 0000 0000  .h..............
        0x0040:  0000 0001 00                             .....
17:13:53.539698 IP (tos 0x0, ttl 216, id 52379, offset 0, flags [DF], proto TCP (6), length 52)
    ec2-18-200-51-80.eu-west-1.compute.amazonaws.com.smpp > 192.168.100.197.60782: Flags [.], cksum 0x8bd3 (correct), seq 422, ack 129, win 210, options [nop,nop,TS val 476579442 ecr 2124471100], length 0
        0x0000:  4500 0034 cc9b 4000 d806 6aa2 12c8 3350  E..4..@...j...3P
        0x0010:  c0a8 64c5 0ad7 ed6e f3fb 9ec0 3a5f 3c79  ..d....n....:_<y
        0x0020:  8010 00d2 8bd3 0000 0101 080a 1c68 0672  .............h.r
        0x0030:  7ea0 db3c                                ~..<
17:14:08.965831 IP (tos 0x0, ttl 64, id 53218, offset 0, flags [none], proto TCP (6), length 40)
    192.168.100.197.60782 > ec2-18-200-51-80.eu-west-1.compute.amazonaws.com.smpp: Flags [.], cksum 0x3a74 (correct), seq 128, ack 422, win 2049, length 0
        0x0000:  4500 0028 cfe2 0000 4006 3f68 c0a8 64c5  E..(....@.?h..d.
        0x0010:  12c8 3350 ed6e 0ad7 3a5f 3c78 f3fb 9ec0  ..3P.n..:_<x....
        0x0020:  5010 0801 3a74 0000                      P...:t..
17:14:09.159688 IP (tos 0x0, ttl 216, id 52380, offset 0, flags [DF], proto TCP (6), length 52)
    ec2-18-200-51-80.eu-west-1.compute.amazonaws.com.smpp > 192.168.100.197.60782: Flags [.], cksum 0x4ea4 (correct), seq 422, ack 129, win 210, options [nop,nop,TS val 476595105 ecr 2124471100], length 0
        0x0000:  4500 0034 cc9c 4000 d806 6aa1 12c8 3350  E..4..@...j...3P
        0x0010:  c0a8 64c5 0ad7 ed6e f3fb 9ec0 3a5f 3c79  ..d....n....:_<y
        0x0020:  8010 00d2 4ea4 0000 0101 080a 1c68 43a1  ....N........hC.
        0x0030:  7ea0 db3c                                ~..<
17:14:24.690489 IP (tos 0x0, ttl 64, id 7362, offset 0, flags [none], proto TCP (6), length 40)
    192.168.100.197.60782 > ec2-18-200-51-80.eu-west-1.compute.amazonaws.com.smpp: Flags [.], cksum 0x3a74 (correct), seq 128, ack 422, win 2049, length 0
        0x0000:  4500 0028 1cc2 0000 4006 f288 c0a8 64c5  E..(....@.....d.
        0x0010:  12c8 3350 ed6e 0ad7 3a5f 3c78 f3fb 9ec0  ..3P.n..:_<x....
        0x0020:  5010 0801 3a74 0000                      P...:t..
17:14:24.865648 IP (tos 0x0, ttl 216, id 52381, offset 0, flags [DF], proto TCP (6), length 52)
    ec2-18-200-51-80.eu-west-1.compute.amazonaws.com.smpp > 192.168.100.197.60782: Flags [.], cksum 0x1147 (correct), seq 422, ack 129, win 210, options [nop,nop,TS val 476610814 ecr 2124471100], length 0
        0x0000:  4500 0034 cc9d 4000 d806 6aa0 12c8 3350  E..4..@...j...3P
        0x0010:  c0a8 64c5 0ad7 ed6e f3fb 9ec0 3a5f 3c79  ..d....n....:_<y
        0x0020:  8010 00d2 1147 0000 0101 080a 1c68 80fe  .....G.......h..
        0x0030:  7ea0 db3c                                ~..<
```

**Comment by sujit-baniya** [comment]
@septs  I can see the DELIVRD packets but wondering why it's not printed on 
```go
func wait() {
	for {
		packet := <-conn.PDU()
		// reply a responsable packet
		if p, ok := packet.(pdu.Responsable); ok {
			fmt.Println(p.Resp())
			err := conn.Send(p.Resp())
			if err != nil {
				fmt.Println(err)
			}
		}
	}
}
```

**Comment by septs** [comment]
plz provide `pcap` file format, thanks

i need use wireshark analyze it.

**Comment by septs** [comment]
> @septs I can see the DELIVRD packets but wondering why it's not printed on
> 
> ```go
> func wait() {
> 	for {
> 		packet := <-conn.PDU()
> 		// reply a responsable packet
> 		if p, ok := packet.(pdu.Responsable); ok {
> 			fmt.Println(p.Resp())
> 			err := conn.Send(p.Resp())
> 			if err != nil {
> 				fmt.Println(err)
> 			}
> 		}
> 	}
> }
> ```

```go
func wait() {
	for {
		packet := <-conn.PDU()
		fmt.Println(p) // add the line!
		// reply a responsable packet
		if p, ok := packet.(pdu.Responsable); ok {
			fmt.Println(p.Resp())
			err := conn.Send(p.Resp())
			if err != nil {
				fmt.Println(err)
			}
		}
	}
}

```

**Comment by sujit-baniya** [comment]
@septs 

Code:
```go
func wait() {
	for {
		packet := <-conn.PDU()
		fmt.Println(packet)
		if p, ok := packet.(pdu.Responsable); ok {
			err := conn.Send(p.Resp())
			if err != nil {
				fmt.Println(err)
			}
		}
	}
}
```

```
&{{81 submit_sm_resp ESME_ROK 2019727887} c3b5fb34d4c1cda561099ff122feffe674cd1a3fb051e51d17fa0bbf474a5a9e}
&{{287 deliver_sm ESME_ROK 1}  +99919821 +00919821 00000100 0 0   00000000 false {0 00000000 map[] [105 100 58 99 51 98 53 102 98 51 52 100 52 99 49 99 100 97 53 54 49 48 57 57 102 102 49 50 50 102 101 102 102 101 54 55 52 99 100 49 97 51 102 98 48 53 49 101 53 49 100 49 55 102 97 48 98 98 102 52 55 52 97 53 97 57 101 32 115 117 98 58 48 48 48 32 100 108 118 114 100 58 48 48 49 32 115 117 98 109 105 116 32 100 97 116 101 58 50 49 48 55 50 56 49 49 52 57 32 100 111 110 101 32 100 97 116 101 58 50 49 48 55 50 56 49 49 52 57 32 115 116 97 116 58 68 69 76 73 86 82 68 32 101 114 114 58 48 48 48 32 116 101 120 116 58 0]} map[30:[99 51 98 53 102 98 51 52 100 52 99 49 99 100 97 53 54 49 48 57 57 102 102 49 50 50 102 101 102 102 101 54 55 52 99 100 49 97 51 102 98 48 53 49 101 53 49 100 49 55 102 97 48 98 98 102 52 55 52 97 53 97 57 101 0] 1059:[3 0 0] 1063:[2]]}
&{{0 00000000 ESME_ROK 1}  map[]}
```

**Comment by septs** [comment]
please provide a packet capture record, thanks

i need you use `pcap` file format record, i use wireshark analyze the problem.

**Comment by sujit-baniya** [comment]
@septs I sent on email. On Wireshark, I don't see DELIVRD status receipt

**Comment by sujit-baniya** [comment]
One thing I noticed, the DELIVRD is received on ENQUIRE_LINK packet
<img width="1068" alt="Screen Shot 2021-07-28 at 17 58 41" src="https://user-images.githubusercontent.com/4959215/127320449-9c167b3f-46a9-444e-8dbe-54c9ea20c754.png">

**Comment by septs** [comment]
:
```
packet := <-conn.PDU()
fmt.Println(packet)
if p, ok := packet.(*pdu.DeliverSM); ok {
	messageState := p.Tags[0x0427][0]
	// ... you business logic ...
	// e.g: if messageState == 2
	_ = conn.Send(p.Resp())
}
```

**Comment by sujit-baniya** [comment]
@septs This will not work for business as for DeliverSM, it needs MessageID, status and other flags for further processing.
But with above code I get following:

```go
func wait() {
	for {
		packet := <-conn.PDU()

		if p, ok := packet.(*pdu.DeliverSM); ok {
			fmt.Println(p.Resp())
			messageState := p.Tags[0x0427][0]
			fmt.Println(messageState)
			// ... you business logic ...
			// e.g: if messageState == 2
			err := conn.Send(p.Resp())
			if err != nil {
				fmt.Println(err)
			}
		}
	}
}
```

**Comment by septs** [comment]
<img width="724" alt="CleanShot 2021-07-28 at 20 35 33@2x" src="https://user-images.githubusercontent.com/3842474/127323036-3a5de831-8612-4f74-9ad9-b09db77e64ce.png">

```
p.Tags[0x0427] // message_state
p.Tags[0x0423] // network_error_code
p.Tags[0x001e] // receipted_message_id
// etc...
```

**Comment by sujit-baniya** [comment]
@septs Thanks it worked..

**Comment by sujit-baniya** [comment]
@septs Wouldn't it be good if you added const for such Tags?

**Comment by septs** [comment]
i think no need
